{"atualizada_em":"2026-08-11T15:49:36.387535Z","configuracao_sha256":"798f8182793b96650bfa4e89a7c73df4271f5548cebc5289e0dee00b2664d0bc","corpus_lock_sha256":"54e98c0d00980ed9baba9943a8fa5f82734739dd037632909ca19c6eef980168","criada_em":"2026-08-11T14:46:16.591181Z","fila_lock_sha256":"4399d4a95ba35de18f337043f781e55802304627c6c62f41cea3a59d8bb0983f","itens":[{"alvo":"ALVO-0025","condicao":"C1","estado":"concluida","execucao_id":"C1-ALVO-0025-R01","falha_tipo":null,"historico":[{"desfecho":"falha","falha_tipo":"formato","inicio_utc":"2026-08-11T14:46:29.267449Z","manifesto_relativo":"resultados/C1-ALVO-0025-R01/tentativa-001/manifesto.json","tentativa":1,"termino_utc":"2026-08-11T14:46:42.081093Z"},{"desfecho":"interrompida","falha_tipo":"interrompida","inicio_utc":"2026-08-11T15:46:59.721341Z","manifesto_relativo":null,"tentativa":2,"termino_utc":"2026-08-11T15:46:59.721341Z"},{"desfecho":"concluida","falha_tipo":null,"inicio_utc":"2026-08-11T15:47:16.785718Z","manifesto_relativo":"resultados/C1-ALVO-0025-R01/tentativa-003/manifesto.json","tentativa":3,"termino_utc":"2026-08-11T15:47:29.410631Z"}],"inicio_utc":"2026-08-11T15:47:16.785718Z","manifesto_relativo":"resultados/C1-ALVO-0025-R01/tentativa-003/manifesto.json","repeticao":1,"tentativa":3,"termino_utc":"2026-08-11T15:47:29.410631Z"},{"alvo":"ALVO-0010","condicao":"C1","estado":"concluida","execucao_id":"C1-ALVO-0010-R01","falha_tipo":null,"historico":[{"desfecho":"concluida","falha_tipo":null,"inicio_utc":"2026-08-11T14:46:56.114949Z","manifesto_relativo":"resultados/C1-ALVO-0010-R01/tentativa-001/manifesto.json","tentativa":1,"termino_utc":"2026-08-11T14:47:03.525754Z"}],"inicio_utc":"2026-08-11T14:46:56.114949Z","manifesto_relativo":"resultados/C1-ALVO-0010-R01/tentativa-001/manifesto.json","repeticao":1,"tentativa":1,"termino_utc":"2026-08-11T14:47:03.525754Z"},{"alvo":"ALVO-0010","condicao":"C2","estado":"concluida","execucao_id":"C2-ALVO-0010-R01","falha_tipo":null,"historico":[{"desfecho":"concluida","falha_tipo":null,"inicio_utc":"2026-08-11T14:47:17.309149Z","manifesto_relativo":"resultados/C2-ALVO-0010-R01/tentativa-001/manifesto.json","tentativa":1,"termino_utc":"2026-08-11T14:47:52.053238Z"}],"inicio_utc":"2026-08-11T14:47:17.309149Z","manifesto_relativo":"resultados/C2-ALVO-0010-R01/tentativa-001/manifesto.json","repeticao":1,"tentativa":1,"termino_utc":"2026-08-11T14:47:52.053238Z"},{"alvo":"ALVO-0007","condicao":"C1","estado":"concluida","execucao_id":"C1-ALVO-0007-R01","falha_tipo":null,"historico":[{"desfecho":"concluida","falha_tipo":null,"inicio_utc":"2026-08-11T14:48:05.766299Z","manifesto_relativo":"resultados/C1-ALVO-0007-R01/tentativa-001/manifesto.json","tentativa":1,"termino_utc":"2026-08-11T14:48:14.835854Z"}],"inicio_utc":"2026-08-11T14:48:05.766299Z","manifesto_relativo":"resultados/C1-ALVO-0007-R01/tentativa-001/manifesto.json","repeticao":1,"tentativa":1,"termino_utc":"2026-08-11T14:48:14.835854Z"},{"alvo":"ALVO-0006","condicao":"C2","estado":"concluida","execucao_id":"C2-ALVO-0006-R01","falha_tipo":null,"historico":[{"desfecho":"concluida","falha_tipo":null,"inicio_utc":"2026-08-11T14:48:28.539641Z","manifesto_relativo":"resultados/C2-ALVO-0006-R01/tentativa-001/manifesto.json","tentativa":1,"termino_utc":"2026-08-11T14:49:06.375621Z"}],"inicio_utc":"2026-08-11T14:48:28.539641Z","manifesto_relativo":"resultados/C2-ALVO-0006-R01/tentativa-001/manifesto.json","repeticao":1,"tentativa":1,"termino_utc":"2026-08-11T14:49:06.375621Z"},{"alvo":"ALVO-0011","condicao":"C2","estado":"concluida","execucao_id":"C2-ALVO-0011-R01","falha_tipo":null,"historico":[{"desfecho":"concluida","falha_tipo":null,"inicio_utc":"2026-08-11T14:49:23.975253Z","manifesto_relativo":"resultados/C2-ALVO-0011-R01/tentativa-001/manifesto.json","tentativa":1,"termino_utc":"2026-08-11T14:50:01.937880Z"}],"inicio_utc":"2026-08-11T14:49:23.975253Z","manifesto_relativo":"resultados/C2-ALVO-0011-R01/tentativa-001/manifesto.json","repeticao":1,"tentativa":1,"termino_utc":"2026-08-11T14:50:01.937880Z"},{"alvo":"ALVO-0008","condicao":"C1","estado":"concluida","execucao_id":"C1-ALVO-0008-R01","falha_tipo":null,"historico":[{"desfecho":"concluida","falha_tipo":null,"inicio_utc":"2026-08-11T14:50:20.114403Z","manifesto_relativo":"resultados/C1-ALVO-0008-R01/tentativa-001/manifesto.json","tentativa":1,"termino_utc":"2026-08-11T14:50:32.384851Z"}],"inicio_utc":"2026-08-11T14:50:20.114403Z","manifesto_relativo":"resultados/C1-ALVO-0008-R01/tentativa-001/manifesto.json","repeticao":1,"tentativa":1,"termino_utc":"2026-08-11T14:50:32.384851Z"},{"alvo":"ALVO-0023","condicao":"C1","estado":"concluida","execucao_id":"C1-ALVO-0023-R01","falha_tipo":null,"historico":[{"desfecho":"concluida","falha_tipo":null,"inicio_utc":"2026-08-11T14:50:47.364658Z","manifesto_relativo":"resultados/C1-ALVO-0023-R01/tentativa-001/manifesto.json","tentativa":1,"termino_utc":"2026-08-11T14:50:55.294918Z"}],"inicio_utc":"2026-08-11T14:50:47.364658Z","manifesto_relativo":"resultados/C1-ALVO-0023-R01/tentativa-001/manifesto.json","repeticao":1,"tentativa":1,"termino_utc":"2026-08-11T14:50:55.294918Z"},{"alvo":"ALVO-0002","condicao":"C2","estado":"concluida","execucao_id":"C2-ALVO-0002-R01","falha_tipo":null,"historico":[{"desfecho":"interrompida","falha_tipo":"interrompida","inicio_utc":"2026-08-11T14:51:09.122188Z","manifesto_relativo":null,"tentativa":1,"termino_utc":"2026-08-11T14:51:32.463617Z"},{"desfecho":"concluida","falha_tipo":null,"inicio_utc":"2026-08-11T14:51:48.965750Z","manifesto_relativo":"resultados/C2-ALVO-0002-R01/tentativa-002/manifesto.json","tentativa":2,"termino_utc":"2026-08-11T14:52:35.287757Z"}],"inicio_utc":"2026-08-11T14:51:48.965750Z","manifesto_relativo":"resultados/C2-ALVO-0002-R01/tentativa-002/manifesto.json","repeticao":1,"tentativa":2,"termino_utc":"2026-08-11T14:52:35.287757Z"},{"alvo":"ALVO-0016","condicao":"C1","estado":"concluida","execucao_id":"C1-ALVO-0016-R01","falha_tipo":null,"historico":[{"desfecho":"concluida","falha_tipo":null,"inicio_utc":"2026-08-11T14:52:49.266093Z","manifesto_relativo":"resultados/C1-ALVO-0016-R01/tentativa-001/manifesto.json","tentativa":1,"termino_utc":"2026-08-11T14:52:56.934851Z"}],"inicio_utc":"2026-08-11T14:52:49.266093Z","manifesto_relativo":"resultados/C1-ALVO-0016-R01/tentativa-001/manifesto.json","repeticao":1,"tentativa":1,"termino_utc":"2026-08-11T14:52:56.934851Z"},{"alvo":"ALVO-0002","condicao":"C1","estado":"concluida","execucao_id":"C1-ALVO-0002-R01","falha_tipo":null,"historico":[{"desfecho":"falha","falha_tipo":"formato","inicio_utc":"2026-08-11T14:53:10.758738Z","manifesto_relativo":"resultados/C1-ALVO-0002-R01/tentativa-001/manifesto.json","tentativa":1,"termino_utc":"2026-08-11T14:53:21.380341Z"},{"desfecho":"interrompida","falha_tipo":"interrompida","inicio_utc":"2026-08-11T15:47:00.754665Z","manifesto_relativo":null,"tentativa":2,"termino_utc":"2026-08-11T15:47:00.754665Z"},{"desfecho":"concluida","falha_tipo":null,"inicio_utc":"2026-08-11T15:47:31.443204Z","manifesto_relativo":"resultados/C1-ALVO-0002-R01/tentativa-003/manifesto.json","tentativa":3,"termino_utc":"2026-08-11T15:47:41.794289Z"}],"inicio_utc":"2026-08-11T15:47:31.443204Z","manifesto_relativo":"resultados/C1-ALVO-0002-R01/tentativa-003/manifesto.json","repeticao":1,"tentativa":3,"termino_utc":"2026-08-11T15:47:41.794289Z"},{"alvo":"ALVO-0004","condicao":"C2","estado":"concluida","execucao_id":"C2-ALVO-0004-R01","falha_tipo":null,"historico":[{"desfecho":"concluida","falha_tipo":null,"inicio_utc":"2026-08-11T14:53:35.236346Z","manifesto_relativo":"resultados/C2-ALVO-0004-R01/tentativa-001/manifesto.json","tentativa":1,"termino_utc":"2026-08-11T14:54:20.639511Z"}],"inicio_utc":"2026-08-11T14:53:35.236346Z","manifesto_relativo":"resultados/C2-ALVO-0004-R01/tentativa-001/manifesto.json","repeticao":1,"tentativa":1,"termino_utc":"2026-08-11T14:54:20.639511Z"},{"alvo":"ALVO-0024","condicao":"C1","estado":"concluida","execucao_id":"C1-ALVO-0024-R01","falha_tipo":null,"historico":[{"desfecho":"concluida","falha_tipo":null,"inicio_utc":"2026-08-11T14:54:42.186700Z","manifesto_relativo":"resultados/C1-ALVO-0024-R01/tentativa-001/manifesto.json","tentativa":1,"termino_utc":"2026-08-11T14:54:58.508164Z"}],"inicio_utc":"2026-08-11T14:54:42.186700Z","manifesto_relativo":"resultados/C1-ALVO-0024-R01/tentativa-001/manifesto.json","repeticao":1,"tentativa":1,"termino_utc":"2026-08-11T14:54:58.508164Z"},{"alvo":"ALVO-0003","condicao":"C1","estado":"concluida","execucao_id":"C1-ALVO-0003-R01","falha_tipo":null,"historico":[{"desfecho":"falha","falha_tipo":"formato","inicio_utc":"2026-08-11T14:55:17.749909Z","manifesto_relativo":"resultados/C1-ALVO-0003-R01/tentativa-001/manifesto.json","tentativa":1,"termino_utc":"2026-08-11T14:55:35.647734Z"},{"desfecho":"interrompida","falha_tipo":"interrompida","inicio_utc":"2026-08-11T15:47:01.825293Z","manifesto_relativo":null,"tentativa":2,"termino_utc":"2026-08-11T15:47:01.825293Z"},{"desfecho":"concluida","falha_tipo":null,"inicio_utc":"2026-08-11T15:47:43.724003Z","manifesto_relativo":"resultados/C1-ALVO-0003-R01/tentativa-003/manifesto.json","tentativa":3,"termino_utc":"2026-08-11T15:48:00.919604Z"}],"inicio_utc":"2026-08-11T15:47:43.724003Z","manifesto_relativo":"resultados/C1-ALVO-0003-R01/tentativa-003/manifesto.json","repeticao":1,"tentativa":3,"termino_utc":"2026-08-11T15:48:00.919604Z"},{"alvo":"ALVO-0015","condicao":"C2","estado":"concluida","execucao_id":"C2-ALVO-0015-R01","falha_tipo":null,"historico":[{"desfecho":"concluida","falha_tipo":null,"inicio_utc":"2026-08-11T14:55:50.045631Z","manifesto_relativo":"resultados/C2-ALVO-0015-R01/tentativa-001/manifesto.json","tentativa":1,"termino_utc":"2026-08-11T14:56:36.704156Z"}],"inicio_utc":"2026-08-11T14:55:50.045631Z","manifesto_relativo":"resultados/C2-ALVO-0015-R01/tentativa-001/manifesto.json","repeticao":1,"tentativa":1,"termino_utc":"2026-08-11T14:56:36.704156Z"},{"alvo":"ALVO-0017","condicao":"C1","estado":"concluida","execucao_id":"C1-ALVO-0017-R01","falha_tipo"